index,title
1,Audio Recording - Q2 FY 2023-24 Earnings Call
2,"Transcript Of Earnings Call For the Year Ended December 31, 2022"
3,Earnings Call For the Unaudited Financial Results - Q3 FY 2022-23
4,Media Call And Earnings Call - Audio Recordings - Q4 FY 2022-23
5,Earnings Call For Q1 And Half-Yearly Financial Results - FY 2023
6,Transcripts Of the Call With Media And Of Earnings Call With Analysts - Q2 FY 2022-23
7,Audio Recording Of Earnings Call Of XYZ Corporation - Q3 FY2023
8,Audio Recording Of the Earnings Call - Q1 FY2022-23
9,Media And Earnings Call - Audio Recordings - Annual Report Overview
10,EARNINGS CALL: Special Update on Strategic Initiatives
11,"Audio Recording Of Earnings Call For the Quarter Ended September 30, 2023"
12,Audio Recording Of Earnings Call - Exclusive CFO Interview
13,Media Call/Earnings Call - Discussion on Market Trends
14,Audio Recording - Earnings Call - Global Expansion Plans
15,Announcement under Regulation 30 (LODR)-Earnings Call Transcript - Regulatory Compliance Update
16,Presentation On Earnings Call Update - Consolidated Results - FY 2022-23
17,Transcripts Of the Conference Call With Media - Financial Outlook for the Next Quarter
18,Earnings Call - Intimation - Changes in Leadership
19,Transcripts Of the Earnings Call With Media - Sustainability Initiatives
20,"Transcript Of Earnings Call For the Second Quarter Ended September 30, 2023"
21,Earnings Call Of ABC Holdings - Emerging Markets Perspective
22,Audio / Video Recording - Earnings Call - Technology and Innovation Highlights
23,Media Call And Earnings Call On Financial Results - Investor Relations Update
24,Earnings Call Highlights - Q4 FY 2022-23 - Strategic Growth Insights
25,"Transcript Of Earnings Call For the Financial Year Ended January 31, 2023"
26,Special Earnings Call - Discussion on Mergers and Acquisitions
27,Media Call And Earnings Call - Audio Recordings - Market Trends Analysis
28,Earnings Call For Half-Yearly Financial Results - FY 2023-24 Forecast
29,Transcripts Of the Call With Media And Of Earnings Call With Analysts - Q3 FY 2022-23
30,Exclusive Audio Recording Of Earnings Call - CEO's Vision for the Future
31,Audio Recording Of the Earnings Call - Q2 FY2022-23 - Investor Q&A Session
32,Media And Earnings Call - Audio Recordings - Regulatory Compliance Update
33,EARNINGS CALL: ESG Initiatives - Sustainable Growth Strategies
34,"Audio Recording Of Earnings Call For the Quarter Ended December 31, 2023 - Regional Expansion Plans"
35,Strategic Earnings Call - Exclusive CFO and CTO Insights
36,Media Call/Earnings Call - Market Disruption Discussion - Tech-driven Solutions
37,Audio Recording - Earnings Call - Product Innovation Showcase
38,Announcement under Regulation 30 (LODR)-Earnings Call Transcript - Financial Restructuring Update
39,Presentation On Earnings Call Update - Breakdown of Revenue Streams - FY 2022-23
40,Transcripts Of the Conference Call With Media - Global Economic Outlook
41,Earnings Call - Intimation - Investor Relations Roadshow Schedule
42,Transcripts Of the Earnings Call With Media - Corporate Social Responsibility Impact
43,"Transcript Of Earnings Call For the Third Quarter Ended March 31, 2023"
44,Earnings Call Of XYZ Financial Group - Emerging Fintech Landscape
45,Audio / Video Recording - Earnings Call - Digital Transformation Strategies
46,Media Call And Earnings Call On Financial Results - Earnings Guidance for the Next Fiscal Year
47,Audio Recording - Earnings Calls For Q1 Of FY 2023-24
48,"Transcript Of Earnings Call For The Year Ended March 31, 2023"
49,"Earnings Call For The Audited Financial Results For The Year Ended March 31, 2023"
50,Media Call And Earnings Call - Audio Recordings
51,Earnings Call For Q4 And Year Ended FY 2022-23
52,Transcripts Of The Call With Media And Of Earnings Call With Analysts And Investors
53,Audio Recording Of Earnings Call Of Axis Bank Limited ('Bank') - Q3FY23
54,Audio Recording Of The Earnings Call - Q3 FY2022-23
55,Media And Earnings Call - Audio Recordings
56,EARNINGS CALL:
57,"Audio Recording Of Earnings Call For The Quarter Ended June 30, 2023"
58,Audio Recording Of Earnings Call
59,Media Call/Earnings Call
60,Audio Recording - Earnings Call
61,Announcement under Regulation 30 (LODR)-Earnings Call Transcript
62,"Presentation On Earnings Call Update - Consolidated And Standalone Audited Financial Results Of The Bank For The Financial Year Ended March 31, 2023"
63,Transcripts Of The Conference Call With Media And Of Earnings Call With Analysts And Investors.
64,Earnings Call - Intimation
65,Transcripts Of The Earnings Call With Media And Of Earnings Call With Analysts And Investors.
66,"Transcript Of Earnings Call For The First Quarter Ended June 30, 2023"
67,Earnings Call Of Axis Bank Limited
68,Audio / Video Recording - Earnings Call
69,Media Call And Earnings Call On Financial Results
